Timestamp,Full Name,Email,Name of Organization ,Services interested in ,Note,Lead Status,Follow-up sent
1/29/2026 13:53:55,Glory Chibuike,evergrn504real@gmail.com,Solid Rock Construction,General administrative VA support,Testing Lead intake Form,Contacted,Yes
1/29/2026 13:55:04,Calista Emmanuel,evergrn405real@gmail.com,Amazing Grace Insurance,AI automation,Confirming sheets Default,Contacted ,Yes
1/29/2026 14:02:22,Samuel Chukwu,Samuelchukwu@gmail.com,Growthers Roofing,"Google Workspace (Docs, Sheets, Gmail, Scheduling, e.t.c)",Testing Default Adjustment,Contacted ,Yes
1/30/2026 4:14:46,Emmanuel Ike,Emmaike46@gmail.com,Reassurance Real Estate,"Google Workspace (Docs, Sheets, Gmail, Scheduling, e.t.c)",Updating Sheets,Contacted ,Yes
1/30/2026 6:20:51,Vivian Castor,castorviv@gmail.com,Zillion Bank,General administrative VA support,testing make automation,Contacted ,Yes
1/30/2026 9:47:41,Richard Obi,richardobi@gmail.com,Obi-son Group of companies,General administrative VA support,,Contacted,Yes
1/30/2026 10:59:46,Nancy Adams,Evergrn405real@gmail.com,Evergreen Virtuals,AI automation,confirming email message from make,Contacted,Yes
1/30/2026 11:54:34,Ifeanyi Mmadu,evergrn405real@gmail.com,Prestige consulting ,AI automation,Testing email message ,Contacted,Yes